{
  "report_id": "eval-2026-09-30",
  "scenario": "main",
  "model_version": "risk-xgb-0.1.0",
  "max_gap_threshold": {
    "value": 5.0,
    "unit": "percentage_points",
    "provenance": {
      "origin": "Contract example: NFR-04 threshold",
      "period_start": "2025-10-01",
      "period_end": "2026-09-30",
      "nature": "synthetic"
    }
  },
  "dimensions": [
    {
      "dimension": "new_customers",
      "segments": [
        {
          "segment": "new, under 90 days",
          "false_positive_rate": {
            "value": 0.031,
            "unit": "ratio",
            "provenance": {
              "origin": "Contract example: offline evaluation report eval-2026-09-30 on synthetic labels, test months",
              "period_start": "2026-07-01",
              "period_end": "2026-09-30",
              "nature": "synthetic"
            }
          },
          "customers": {
            "value": 610,
            "unit": "count",
            "provenance": {
              "origin": "Contract example: offline evaluation report eval-2026-09-30 on synthetic labels, test months",
              "period_start": "2026-07-01",
              "period_end": "2026-09-30",
              "nature": "synthetic"
            }
          }
        },
        {
          "segment": "established",
          "false_positive_rate": {
            "value": 0.019,
            "unit": "ratio",
            "provenance": {
              "origin": "Contract example: offline evaluation report eval-2026-09-30 on synthetic labels, test months",
              "period_start": "2026-07-01",
              "period_end": "2026-09-30",
              "nature": "synthetic"
            }
          },
          "customers": {
            "value": 3570,
            "unit": "count",
            "provenance": {
              "origin": "Contract example: offline evaluation report eval-2026-09-30 on synthetic labels, test months",
              "period_start": "2026-07-01",
              "period_end": "2026-09-30",
              "nature": "synthetic"
            }
          }
        }
      ],
      "max_gap": {
        "value": 1.2,
        "unit": "percentage_points",
        "provenance": {
          "origin": "Contract example: offline evaluation report eval-2026-09-30 on synthetic labels, test months",
          "period_start": "2026-07-01",
          "period_end": "2026-09-30",
          "nature": "synthetic"
        }
      },
      "warning": false
    },
    {
      "dimension": "households",
      "segments": [
        {
          "segment": "address shared with linked accounts",
          "false_positive_rate": {
            "value": 0.027,
            "unit": "ratio",
            "provenance": {
              "origin": "Contract example: offline evaluation report eval-2026-09-30 on synthetic labels, test months",
              "period_start": "2026-07-01",
              "period_end": "2026-09-30",
              "nature": "synthetic"
            }
          },
          "customers": {
            "value": 702,
            "unit": "count",
            "provenance": {
              "origin": "Contract example: offline evaluation report eval-2026-09-30 on synthetic labels, test months",
              "period_start": "2026-07-01",
              "period_end": "2026-09-30",
              "nature": "synthetic"
            }
          }
        },
        {
          "segment": "single account",
          "false_positive_rate": {
            "value": 0.02,
            "unit": "ratio",
            "provenance": {
              "origin": "Contract example: offline evaluation report eval-2026-09-30 on synthetic labels, test months",
              "period_start": "2026-07-01",
              "period_end": "2026-09-30",
              "nature": "synthetic"
            }
          },
          "customers": {
            "value": 3478,
            "unit": "count",
            "provenance": {
              "origin": "Contract example: offline evaluation report eval-2026-09-30 on synthetic labels, test months",
              "period_start": "2026-07-01",
              "period_end": "2026-09-30",
              "nature": "synthetic"
            }
          }
        }
      ],
      "max_gap": {
        "value": 0.7,
        "unit": "percentage_points",
        "provenance": {
          "origin": "Contract example: offline evaluation report eval-2026-09-30 on synthetic labels, test months",
          "period_start": "2026-07-01",
          "period_end": "2026-09-30",
          "nature": "synthetic"
        }
      },
      "warning": false
    },
    {
      "dimension": "low_data",
      "segments": [
        {
          "segment": "fewer than 4 lines",
          "false_positive_rate": {
            "value": 0.072,
            "unit": "ratio",
            "provenance": {
              "origin": "Contract example: offline evaluation report eval-2026-09-30 on synthetic labels, test months",
              "period_start": "2026-07-01",
              "period_end": "2026-09-30",
              "nature": "synthetic"
            }
          },
          "customers": {
            "value": 388,
            "unit": "count",
            "provenance": {
              "origin": "Contract example: offline evaluation report eval-2026-09-30 on synthetic labels, test months",
              "period_start": "2026-07-01",
              "period_end": "2026-09-30",
              "nature": "synthetic"
            }
          }
        },
        {
          "segment": "4 lines or more",
          "false_positive_rate": {
            "value": 0.011,
            "unit": "ratio",
            "provenance": {
              "origin": "Contract example: offline evaluation report eval-2026-09-30 on synthetic labels, test months",
              "period_start": "2026-07-01",
              "period_end": "2026-09-30",
              "nature": "synthetic"
            }
          },
          "customers": {
            "value": 3792,
            "unit": "count",
            "provenance": {
              "origin": "Contract example: offline evaluation report eval-2026-09-30 on synthetic labels, test months",
              "period_start": "2026-07-01",
              "period_end": "2026-09-30",
              "nature": "synthetic"
            }
          }
        }
      ],
      "max_gap": {
        "value": 6.1,
        "unit": "percentage_points",
        "provenance": {
          "origin": "Contract example: offline evaluation report eval-2026-09-30 on synthetic labels, test months",
          "period_start": "2026-07-01",
          "period_end": "2026-09-30",
          "nature": "synthetic"
        }
      },
      "warning": true
    },
    {
      "dimension": "tenure",
      "segments": [
        {
          "segment": "under 1 year",
          "false_positive_rate": {
            "value": 0.024,
            "unit": "ratio",
            "provenance": {
              "origin": "Contract example: offline evaluation report eval-2026-09-30 on synthetic labels, test months",
              "period_start": "2026-07-01",
              "period_end": "2026-09-30",
              "nature": "synthetic"
            }
          },
          "customers": {
            "value": 1460,
            "unit": "count",
            "provenance": {
              "origin": "Contract example: offline evaluation report eval-2026-09-30 on synthetic labels, test months",
              "period_start": "2026-07-01",
              "period_end": "2026-09-30",
              "nature": "synthetic"
            }
          }
        },
        {
          "segment": "1 to 3 years",
          "false_positive_rate": {
            "value": 0.018,
            "unit": "ratio",
            "provenance": {
              "origin": "Contract example: offline evaluation report eval-2026-09-30 on synthetic labels, test months",
              "period_start": "2026-07-01",
              "period_end": "2026-09-30",
              "nature": "synthetic"
            }
          },
          "customers": {
            "value": 1820,
            "unit": "count",
            "provenance": {
              "origin": "Contract example: offline evaluation report eval-2026-09-30 on synthetic labels, test months",
              "period_start": "2026-07-01",
              "period_end": "2026-09-30",
              "nature": "synthetic"
            }
          }
        },
        {
          "segment": "over 3 years",
          "false_positive_rate": {
            "value": 0.015,
            "unit": "ratio",
            "provenance": {
              "origin": "Contract example: offline evaluation report eval-2026-09-30 on synthetic labels, test months",
              "period_start": "2026-07-01",
              "period_end": "2026-09-30",
              "nature": "synthetic"
            }
          },
          "customers": {
            "value": 900,
            "unit": "count",
            "provenance": {
              "origin": "Contract example: offline evaluation report eval-2026-09-30 on synthetic labels, test months",
              "period_start": "2026-07-01",
              "period_end": "2026-09-30",
              "nature": "synthetic"
            }
          }
        }
      ],
      "max_gap": {
        "value": 0.9,
        "unit": "percentage_points",
        "provenance": {
          "origin": "Contract example: offline evaluation report eval-2026-09-30 on synthetic labels, test months",
          "period_start": "2026-07-01",
          "period_end": "2026-09-30",
          "nature": "synthetic"
        }
      },
      "warning": false
    },
    {
      "dimension": "price_band",
      "segments": [
        {
          "segment": "under 50 EUR",
          "false_positive_rate": {
            "value": 0.017,
            "unit": "ratio",
            "provenance": {
              "origin": "Contract example: offline evaluation report eval-2026-09-30 on synthetic labels, test months",
              "period_start": "2026-07-01",